{
  "capabilityId": "native-execution-speed-contract",
  "requestedIntent": "Offer an explicit opt-in speed helper for reversible contained work without treating installation as ACEF admission or governing ordinary repository-native execution.",
  "status": "enforced",
  "requiredLayers": [
    "docs",
    "workflow",
    "hook",
    "installer",
    "tests"
  ],
  "implementedLayers": {
    "docs": [
      "AGENTS.md#ACEF Admission",
      "method/DELIVERY_RULES.md",
      "method/OPERATING_MODEL.md",
      "skills/acef/SKILL.md"
    ],
    "workflow": [
      "scripts/acef-native-test",
      "scripts/lib/acef-native-speed.js"
    ],
    "hook": [
      "claude-plugins/acef-bmad-guard/hooks/acef-bmad-hard-wall.mjs"
    ],
    "installer": [
      "scripts/install-acef-tools",
      "scripts/install-acef-bmad-guard"
    ],
    "tests": [
      "scripts/test-acef-native-test",
      "scripts/test-acef-process-validator",
      "scripts/test-install-acef-tools"
    ]
  },
  "limitations": [
    "Installation alone is inert. Raw commands and agent use are never intercepted without an active ACEF lifecycle; the speed limits are enforced only after a caller explicitly invokes acef-native-test.",
    "A stable --work-unit is caller-supplied only when independently admitted children share a branch and HEAD; ordinary native work keeps the zero-configuration default budget.",
    "The 10-minute budget measures actual execution time of explicitly wrapped verification commands, not agent reasoning, read-only inspection, or unwrapped repository-native work.",
    "Broad closeout is intentionally allowed once on a clean worktree and may run for up to 30 minutes because it is a separate batch-level certification action, not native implementation feedback."
  ],
  "evidence": [
    {
      "layer": "workflow",
      "ref": "scripts/test-acef-native-test",
      "note": "Covers isolated named-work-unit budgets and successful focused verification receipts."
    },
    {
      "layer": "hook",
      "ref": "scripts/test-acef-process-validator"
    },
    {
      "layer": "installer",
      "ref": "scripts/test-install-acef-tools"
    }
  ],
  "createdAt": "2026-08-06"
}
