{
  "capabilityId": "execution-workflow-assurance-separation",
  "requestedIntent": "Separate ACEF execution depth from risk assurance so Guarded adds controls without duplicating BMAD or turning compact work into the Full lifecycle.",
  "status": "enforced",
  "requiredLayers": [
    "docs",
    "schema",
    "workflow",
    "validator",
    "hook",
    "tests",
    "installer"
  ],
  "implementedLayers": {
    "docs": [
      "AGENTS.md#ACEF Admission",
      "README.md",
      "method/OPERATING_MODEL.md#Admission, execution workflow, and assurance",
      "method/DELIVERY_RULES.md#Execution workflow and assurance",
      "CHANGELOG.md#Execution workflow and assurance separated"
    ],
    "schema": [
      "schemas/active-run-v2.schema.json",
      "schemas/lightweight-run-v2.schema.json",
      "schemas/control-dosing-v2.schema.json"
    ],
    "workflow": [
      "scripts/lib/acef-execution-policy.js",
      "scripts/lib/acef-state-parser.js#parseActiveRun",
      "scripts/acef-state#writeActiveRun",
      "scripts/acef-state#migrateActiveRun",
      "method/control-dosing.json"
    ],
    "validator": [
      "scripts/lib/acef-run-authorization.js#inspectRunAuthorization",
      "scripts/acef-process-validator#checkLaneSelection",
      "scripts/acef-process-validator#checkLaneCloseout",
      "scripts/acef-process-validator#checkGuardedTestFloor",
      "scripts/acef-process-validator#checkActorSeparation"
    ],
    "hook": [
      "claude-plugins/acef-bmad-guard/hooks/acef-bmad-hard-wall.mjs#hasLaneMarker",
      "claude-plugins/acef-bmad-guard/hooks/acef-bmad-hard-wall.mjs#activeAssuranceProfile"
    ],
    "tests": [
      "scripts/test-acef-execution-policy",
      "scripts/test-acef-state",
      "scripts/test-acef-control-dosing",
      "scripts/test-acef-run-authorization",
      "scripts/test-acef-process-validator",
      "scripts/test-install-acef-tools"
    ],
    "installer": [
      "scripts/install-acef-tools",
      "scripts/install-acef-bmad-guard"
    ]
  },
  "limitations": [
    "Direct compatibility remains readable during the installed-project upgrade bridge, but new Direct admission is still rejected.",
    "Legacy active runs with lane guarded are intentionally fail-closed until a human selects the missing execution workflow.",
    "The capability is enforced in this source tree; target repositories must update their installed ACEF tools and hooks before they receive it."
  ],
  "evidence": [
    {
      "layer": "tests",
      "ref": "scripts/test-acef-execution-policy",
      "note": "Exercises all three workflows under Baseline and Guarded and proves the overlay is monotonic."
    },
    {
      "layer": "tests",
      "ref": "scripts/test-acef-process-validator",
      "note": "Exercises validator and hook enforcement, including stock BMAD non-activation."
    },
    {
      "layer": "installer",
      "ref": "scripts/test-install-acef-tools",
      "note": "Verifies installed state/parser/validator and schema behavior."
    }
  ],
  "createdAt": "2026-07-31"
}
