{
  "capabilityId": "full-flow-surface-validation",
  "requestedIntent": "Require full BMAD and guarded story close to prove the changed behavior at the touched runtime surface.",
  "status": "proven",
  "requiredLayers": [
    "docs",
    "workflow",
    "validator",
    "tests"
  ],
  "implementedLayers": {
    "docs": [
      "method/OPERATING_MODEL.md#Story-close evidence minimums",
      "skills/acef/references/ACEF_OPERATING_MODEL.md#Story-close evidence minimums"
    ],
    "workflow": [
      "schemas/active-run.schema.json",
      "schemas/worker-scope.schema.json",
      "schemas/gate.schema.json",
      "schemas/evidence.schema.json"
    ],
    "validator": [
      "scripts/acef-process-validator#checkGateVerdict"
    ],
    "tests": [
      "scripts/test-acef-process-validator"
    ]
  },
  "limitations": [
    "Enforcement applies to typed full-bmad and guarded PASS gates.",
    "Lightweight lanes enforce surface validation through ACEF_LIGHTWEIGHT_RUN.json instead of typed gate-verdict evidence.",
    "The validator checks that every declared worker-scope surface has successful gate surfaceEvidence backed by typed runner-proof evidence, and uses path-name inference to catch obvious underdeclared surfaces; inference is heuristic."
  ],
  "evidence": [
    {
      "layer": "docs",
      "ref": "method/OPERATING_MODEL.md#Story-close evidence minimums"
    },
    {
      "layer": "workflow",
      "ref": "schemas/gate.schema.json"
    },
    {
      "layer": "validator",
      "ref": "scripts/acef-process-validator#checkGateVerdict"
    },
    {
      "layer": "tests",
      "ref": "scripts/test-acef-process-validator"
    }
  ],
  "createdAt": "2026-06-25"
}
