{
  "capabilityId": "provider-neutral-model-routing",
  "requestedIntent": "Select model and reasoning effort by ACEF role while allowing equivalent runtimes from additional LLM providers to be mapped without changing lifecycle semantics.",
  "status": "enforced",
  "requiredLayers": ["docs", "schema", "cli", "hook", "validator", "tests", "installer"],
  "implementedLayers": {
    "docs": [
      "method/BMAD_V2_LANE.md#Optional capsule supervisor runtime",
      "method/DELIVERY_RULES.md#Lanes",
      "skills/acef/references/ACEF_BMAD_V2_LANE.md#Optional capsule supervisor runtime",
      "docs/experiments/execution-assurance-v327/CALIBRATION_DESIGN.md",
      "docs/experiments/execution-assurance-v327/CALIBRATION_RESULT.md",
      "docs/experiments/execution-assurance-v328/REHEARSAL_RESULT.md"
    ],
    "schema": [
      "schemas/model-routing-policy-v1.schema.json",
      "method/model-routing-policy-v1.json"
    ],
    "cli": [
      "scripts/lib/acef-model-routing.js",
      "scripts/lib/acef-execution-assurance-experiment.js#blindJudgeRuntimeProfile",
      "scripts/acef-execution-assurance-experiment#runPilotJudge",
      "scripts/acef-supervisor#modelPolicy",
      "scripts/acef-next#routedRuntime",
      "scripts/acef-state#writeActor",
      "scripts/acef-state#writeReviewCapsule"
    ],
    "hook": [
      "claude-plugins/acef-bmad-guard/hooks/acef-bmad-hard-wall.mjs#admittedModelRoutingRestricted"
    ],
    "validator": [
      "scripts/acef-state#writeActor",
      "scripts/lib/acef-execution-assurance-experiment.js#validateManifest",
      "scripts/acef-execution-assurance-experiment#modelRoutingPolicy"
    ],
    "tests": [
      "scripts/test-acef-model-routing",
      "scripts/test-acef-next",
      "scripts/test-acef-process-validator",
      "scripts/test-acef-quick-fix-single-review",
      "scripts/test-acef-capsule-supervisor",
      "scripts/test-acef-execution-assurance-experiment",
      "docs/experiments/execution-assurance-v327/results/blind-judge.json"
    ],
    "installer": [
      "scripts/install-acef-tools#copyModelRoutingPolicy",
      "scripts/install-acef-tools#defaultModelRoutingContract",
      "scripts/test-install-acef-tools"
    ]
  },
  "limitations": [
    "The calibrated mapping is OpenAI-only (V327-CAL-001 on gpt-5.6-sol; the 2026-10-27 remap to gpt-6.1-sol is not recalibrated). The anthropic mapping (critical Opus, standard/orchestration Sonnet, method/MODEL_CHOICE.md) is an owner decision without role-specific calibration evidence.",
    "Pre-dispatch enforcement is versioned as admitted-role-routing-v1 on new Fix and Standard runs; existing in-flight runs retain their original contract. Native work remains outside ACEF model routing, while Full capsule-supervisor dispatch keeps its existing compiled enforcement.",
    "V327-CAL-001 qualifies medium only for Code Review on one held-out authorization defect. It does not lower ATDD, Development, Patch Assurance, or Process Judge floors.",
    "V3.28 exercised the complete role-routed matrix across four cycle-0 story PASS gates, typed Epic PASS, hard-budget PASS, and a zero-finding high-effort blind product PASS. Its immutable process row still failed on a repaired outer-scorer false negative, so the capability remains enforced rather than proven.",
    "V3.27 also exposed that the external blind Judge inherited the conductor runtime. The successor harness now resolves it from the high terminal epic-process-judge profile, quarantines abandoned launch roots, and produced a valid high-effort FAIL judgment; no invalid medium judgment was persisted."
  ],
  "evidence": [
    { "layer": "tests", "ref": "docs/experiments/execution-assurance-v327/calibration-manifest.json" },
    { "layer": "tests", "ref": "docs/experiments/execution-assurance-v327/CALIBRATION_RESULT.md" },
    { "layer": "tests", "ref": "scripts/test-acef-model-routing" },
    { "layer": "tests", "ref": "scripts/test-acef-capsule-supervisor" },
    { "layer": "tests", "ref": "docs/experiments/execution-assurance-v327/REHEARSAL_RESULT.md" },
    { "layer": "tests", "ref": "docs/experiments/execution-assurance-v328/REHEARSAL_RESULT.md" },
    { "layer": "installer", "ref": "scripts/test-install-acef-tools" }
  ],
  "createdAt": "2026-08-04"
}
