{
  "capabilityId": "direct-task-lane",
  "requestedIntent": "Add a genuinely minimal lane for reversible contained work so ordinary UI, copy, config, docs, mechanical changes, and localized bug fixes do not pay the lightweight six-step lifecycle cost.",
  "status": "enforced",
  "requiredLayers": [
    "docs",
    "schema",
    "cli",
    "validator",
    "tests",
    "installer"
  ],
  "implementedLayers": {
    "docs": [
      "method/OPERATING_MODEL.md#Lanes",
      "method/DELIVERY_RULES.md#Lanes",
      "method/CONTROL_RATIONALE.md#Control-Dosing-Table",
      "method/TYPED_STATE.md",
      "README.md",
      "AGENTS.md#Lane-Entry",
      "skills/acef/SKILL.md#Direct-short-circuit",
      "skills/acef-router/SKILL.md#Routing-Procedure"
    ],
    "schema": [
      "schemas/direct-run.schema.json",
      "schemas/control-dosing.schema.json"
    ],
    "cli": [
      "scripts/acef-state#writeDirectRun",
      "scripts/acef-state#usage",
      "scripts/acef-next#buildDirectNext"
    ],
    "validator": [
      "scripts/acef-process-validator#checkDirectLaneSelection",
      "scripts/acef-process-validator#checkDirectLifecycle",
      "scripts/acef-process-validator#directPromotionReasons"
    ],
    "tests": [
      "scripts/test-acef-direct-lifecycle",
      "scripts/test-acef-control-dosing",
      "scripts/test-install-acef-tools",
      "scripts/test-install-acef-skills",
      "scripts/test-acef-empirical-validation",
      "scripts/test-acef-next",
      "scripts/test-acef-state",
      "scripts/acef-direct-measurement-report"
    ],
    "installer": [
      "scripts/install-acef-tools",
      "scripts/install-acef-skills"
    ]
  },
  "limitations": [
    "Direct closeout records focused verification command and exit code but intentionally does not create evidence manifests or runner proof.",
    "Path and risk inference is heuristic; unusual domain risk that is absent from paths and omitted from riskTriggers cannot be discovered mechanically.",
    "Direct is limited to one attended, reversible technical boundary and must promote when scope, surface count, risk, or test-integrity checks expand.",
    "The preregistered 30-run real-task measurement completed with 0 invalid runs but failed the quality, direct-contract, provider-promotion, context-miss, token, and runtime thresholds. Direct used 190% more paired-median input and took 175.1% more paired-median runtime than baseline; it remains enforced, not proven.",
    "The compact help/context change has deterministic tests but has not yet cleared a repeated real-task cost measurement; the capability therefore remains enforced rather than proven."
  ],
  "evidence": [
    {
      "layer": "schema",
      "ref": "schemas/direct-run.schema.json"
    },
    {
      "layer": "cli",
      "ref": "scripts/acef-state"
    },
    {
      "layer": "validator",
      "ref": "scripts/acef-process-validator"
    },
    {
      "layer": "tests",
      "ref": "scripts/test-acef-direct-lifecycle"
    },
    {
      "layer": "tests",
      "ref": "scripts/test-acef-next",
      "note": "The direct record is projected as the entire current-context boundary without active-run, ledger, or worker bootstrap."
    },
    {
      "layer": "tests",
      "ref": "scripts/test-acef-state",
      "note": "The direct-run subcommand exposes bounded start, close, and promote usage."
    },
    {
      "layer": "installer",
      "ref": "scripts/install-acef-tools"
    },
    {
      "layer": "installer",
      "ref": "scripts/install-acef-skills"
    },
    {
      "layer": "tests",
      "ref": "docs/dogfood-direct-lane-2026-07-30.md",
      "note": "Two disposable real-repository clones passed direct closeout; an intentional migration path was rejected."
    },
    {
      "layer": "tests",
      "ref": "docs/experiments/direct-lane-measurement/DESIGN.md",
      "note": "Preregistered 30-run baseline/direct/lightweight measurement protocol."
    },
    {
      "layer": "tests",
      "ref": "docs/experiments/direct-lane-measurement/report.md",
      "note": "Completed 30-run measurement: 0 invalid, but only 6/8 eligible direct contract passes, 1/2 correct provider promotions, 25% context misses, +190% paired input and +175.1% paired runtime versus baseline. Proven threshold failed."
    },
    {
      "layer": "tests",
      "ref": "docs/experiments/direct-lane-measurement/DATA_QUALITY_REVIEW.md",
      "note": "Raw-row integrity, exact-string oracle correction, escaped-defect interpretation, and paired client-normalized analysis."
    }
  ],
  "createdAt": "2026-07-30"
}
