{
  "capabilityId": "gate-self-certification-guard",
  "requestedIntent": "Prevent guarded and full-BMAD PASS gates from being self-certified by the implementation/developer actor, even when a gate verdict file exists.",
  "status": "enforced",
  "requiredLayers": [
    "docs",
    "validator",
    "hook",
    "installer",
    "tests"
  ],
  "implementedLayers": {
    "docs": [
      "CHANGELOG.md#Gate self-certification guard",
      "method/CONTROL_RATIONALE.md#Why Gate Verdicts Exist",
      "skills/acef/references/ACEF_CONTROL_RATIONALE.md#Why Gate Verdicts Exist"
    ],
    "validator": [
      "scripts/acef-process-validator#checkGateVerdict",
      "scripts/acef-process-validator#checkGateDecider",
      "scripts/acef-process-validator#checkPrecommitGate"
    ],
    "hook": [
      "claude-plugins/acef-bmad-guard/hooks/acef-precommit-gate.sh"
    ],
    "installer": [
      "scripts/install-acef-bmad-guard"
    ],
    "tests": [
      "scripts/test-acef-process-validator"
    ]
  },
  "limitations": [
    "This validates typed gate verdicts and actor records; it cannot prove that an unrecorded nested reviewer existed.",
    "The pre-commit path intentionally checks only gate decider integrity; full surface and persistence evidence remain closeout/CI responsibilities.",
    "Legacy and epic Process Judge identity remains cooperative-local. Four-actor-v3 story PASS is computed from distinct typed actors, red/green ancestry, final-tree review/assurance, report hashes, findings, and runner proof; it still depends on accurate local records."
  ],
  "evidence": [
    {
      "layer": "validator",
      "ref": "scripts/acef-process-validator#checkGateDecider"
    },
    {
      "layer": "hook",
      "ref": "claude-plugins/acef-bmad-guard/hooks/acef-precommit-gate.sh"
    },
    {
      "layer": "tests",
      "ref": "scripts/test-acef-process-validator",
      "note": "Covers both legacy independent-Process-Judge gates and mechanically decided four-actor-v3 story-close gates."
    }
  ],
  "createdAt": "2026-06-28"
}
