{
  "capabilityId": "intake-decision-gate",
  "requestedIntent": "Prevent ACEF agents from entering planning or execution before recording the route/intake decision, explicit ACEF admission, admission topology, clarifying questions or inferred answers, approved interview brief, and execution approval; require every split child to return to admission instead of inheriting its parent run or automatically creating another ACEF lifecycle.",
  "status": "enforced",
  "requiredLayers": [
    "docs",
    "workflow",
    "validator",
    "tests"
  ],
  "implementedLayers": {
    "docs": [
      "method/OPERATING_MODEL.md#Lanes",
      "skills/acef/references/ACEF_OPERATING_MODEL.md#Lanes",
      "skills/acef-router/SKILL.md",
      "skills/acef/references/ACEF_BROWNFIELD_ROUTES.md"
    ],
    "workflow": [
      "schemas/active-run.schema.json",
      "scripts/lib/acef-state-parser.js#parseActiveRun",
      "scripts/acef-state#writeActiveRun"
    ],
    "validator": [
      "scripts/acef-process-validator#checkLaneSelection"
    ],
    "tests": [
      "scripts/test-acef-lightweight-lifecycle",
      "scripts/test-acef-state",
      "scripts/test-acef-typed-state-validator",
      "scripts/test-acef-process-validator"
    ]
  },
  "limitations": [
    "The gate enforces recorded intake, explicit ACEF admission, post-split re-admission, topology-based native rejection, interview brief approval, and execution approval for newly written typed active runs; it does not prove that the human conversation actually happened outside recorded artifacts.",
    "Existing two-axis-v1/v2 records remain readable for compatibility; new state-writer records use two-axis-v3 with reversible, technicalBoundaryCount, and productSurfaceCount.",
    "Target repositories must refresh their ACEF installation before this gate is installed there."
  ],
  "evidence": [
    {
      "layer": "workflow",
      "ref": "schemas/active-run.schema.json"
    },
    {
      "layer": "validator",
      "ref": "scripts/acef-process-validator#checkLaneSelection"
    },
    {
      "layer": "tests",
      "ref": "scripts/test-acef-lightweight-lifecycle"
    }
  ],
  "createdAt": "2026-06-25"
}
