{
  "capabilityId": "installation-version-update",
  "requestedIntent": "Installed target repos must show which ACEF source version they use and have a mechanical update path.",
  "status": "installed",
  "requiredLayers": [
    "docs",
    "cli",
    "installer",
    "tests",
    "targetRepo"
  ],
  "implementedLayers": {
    "docs": [
      "CHANGELOG.md#Installation versioning and update path",
      "README.md#Install & use",
      "CHANGELOG.md#Unreleased — Host fork gates ported upstream; updates keep host-modified files (2026-10-27)"
    ],
    "cli": [
      "scripts/acef-status",
      "scripts/update-acef-installation"
    ],
    "installer": [
      "scripts/lib/acef-installation.js",
      "scripts/install-acef-tools",
      "scripts/install-acef-skills",
      "scripts/install-acef-bmad-guard"
    ],
    "tests": [
      "scripts/test-acef-canonical-root",
      "scripts/test-acef-host-file-preservation",
      "scripts/test-install-acef-skills",
      "scripts/test-install-acef-tools"
    ],
    "targetRepo": [
      "docs/ai/installation-evidence/pilaner-acef-installation.json"
    ]
  },
  "limitations": [
    "ACEF does not yet have a semantic release number; the installed version is the source checkout path plus git commit and dirty/clean state.",
    "The target-local update command requires the recorded source checkout path to remain available."
  ],
  "evidence": [
    {
      "layer": "installer",
      "ref": "scripts/lib/acef-installation.js"
    },
    {
      "layer": "cli",
      "ref": "scripts/update-acef-installation"
    },
    {
      "layer": "cli",
      "ref": "scripts/acef-status"
    },
    {
      "layer": "tests",
      "ref": "scripts/test-install-acef-tools"
    },
    {
      "layer": "tests",
      "ref": "scripts/test-install-acef-skills"
    },
    {
      "layer": "targetRepo",
      "ref": "docs/ai/installation-evidence/pilaner-acef-installation.json"
    },
    {
      "layer": "tests",
      "ref": "scripts/test-acef-host-file-preservation",
      "note": "2026-10-27: host-modified tool, hook and skill files kept and reported; unmodified copies replaced; model routing policy merged (host values kept, new keys added); legacy records use the recorded install commit, including another ACEF checkout."
    }
  ],
  "createdAt": "2026-06-25"
}
