{
  "capabilityId": "control-rationale-documentation",
  "requestedIntent": "Document why ACEF's typed state, actor records, worker scopes, evidence manifests, gate verdicts, approval receipts, active-run state, acef-next projection, surface contracts, and test-integrity checks exist, and how to price or trim them by lane without deleting distinct safety controls.",
  "status": "documented-only",
  "requiredLayers": [
    "docs"
  ],
  "implementedLayers": {
    "docs": [
      "method/CONTROL_RATIONALE.md",
      "skills/acef/references/ACEF_CONTROL_RATIONALE.md",
      "README.md#What's in this repo",
      "skills/acef/SKILL.md#Required References By Situation"
    ]
  },
  "limitations": [
    "This is explanatory documentation only; it does not add or change validators, hooks, schemas, installers, or runtime behavior.",
    "The documented rationale describes why existing controls were added, whether each control is enforcement or audit insurance, which lanes need the stronger dose, and how to decide whether a lane can use a lighter version."
  ],
  "evidence": [
    {
      "layer": "docs",
      "ref": "method/CONTROL_RATIONALE.md"
    },
    {
      "layer": "docs",
      "ref": "skills/acef/references/ACEF_CONTROL_RATIONALE.md"
    },
    {
      "layer": "docs",
      "ref": "README.md#What's in this repo"
    },
    {
      "layer": "docs",
      "ref": "skills/acef/SKILL.md#Required References By Situation"
    }
  ],
  "createdAt": "2026-06-28"
}
